{
  "$schema": "http://json-schema.org/draft-07/schema#",
  "$id": "our.kapitola.schema.json",
  "title": "OpenBudget Internal Chapter Mirror",
  "description": "Schema for our mirrored kapitola.json stored in the main GitLab snippet. Extends the official schema with a stable internal iid identifier.",
  "type": "array",
  "items": {
    "type": "object",
    "required": ["iid", "id", "name", "startDate", "endDate", "expired"],
    "additionalProperties": false,
    "properties": {
      "iid": {
        "type": "integer",
        "description": "OpenBudget-internal stable identifier. Never changes, even when the state reassigns the chapter's id.",
        "minimum": 1
      },
      "id": {
        "type": "integer",
        "description": "State-assigned chapter identifier (may change due to political renumbering)."
      },
      "name": {
        "type": "string",
        "description": "Full English name of the ministry or government body.",
        "minLength": 1
      },
      "startDate": {
        "type": "string",
        "description": "ISO 8601 date when this chapter became active."
      },
      "endDate": {
        "type": "string",
        "description": "ISO 8601 date when this chapter expired, or '9999-12-31' if still active."
      },
      "expired": {
        "type": "boolean",
        "description": "True when the chapter has been dissolved, merged, or disappeared from the official API."
      }
    }
  }
}
